{
  "model_name": "fraud-detection",
  "model_version": "synthetic-v1",
  "reference_id": "synthetic-training-baseline",
  "window_start": "2026-09-29T08:00:00Z",
  "window_end": "2026-09-29T09:00:00Z",
  "distributions": [
    {
      "name": "transaction_amount",
      "scope": "feature",
      "bins": [
        "0-50",
        "50-100",
        "100-500",
        "500-plus"
      ],
      "reference_counts": [
        25,
        25,
        25,
        25
      ],
      "current_counts": [
        5,
        15,
        30,
        50
      ]
    },
    {
      "name": "fraud_probability",
      "scope": "prediction",
      "bins": [
        "0-0.3",
        "0.3-0.7",
        "0.7-1"
      ],
      "reference_counts": [
        70,
        20,
        10
      ],
      "current_counts": [
        20,
        30,
        50
      ]
    }
  ],
  "evidence_refs": [
    "synthetic-feature-histogram",
    "synthetic-score-histogram",
    "synthetic-labels"
  ],
  "performance": {
    "predictions": [
      1,
      1,
      1,
      1,
      1,
      1,
      1,
      1,
      1,
      1,
      0,
      0,
      0,
      0,
      0,
      0,
      0,
      0,
      0,
      0,
      0,
      0,
      0,
      0,
      0,
      0,
      0,
      0,
      0,
      0,
      0,
      0,
      0,
      0,
      0,
      0,
      0,
      0,
      0,
      0,
      0,
      0,
      0,
      0,
      0,
      0,
      0,
      0,
      0,
      0,
      0,
      0,
      0,
      0,
      0,
      0,
      0,
      0,
      0,
      0,
      0,
      0,
      0,
      0,
      0,
      0,
      0,
      0,
      0,
      0,
      0,
      0,
      0,
      0,
      0,
      0,
      0,
      0,
      0,
      0,
      0,
      0,
      0,
      0,
      0,
      0,
      0,
      0,
      0,
      0,
      0,
      0,
      0,
      0,
      0,
      0,
      0,
      0,
      0,
      0
    ],
    "labels": [
      1,
      1,
      1,
      1,
      1,
      1,
      1,
      1,
      1,
      1,
      1,
      1,
      1,
      1,
      1,
      1,
      1,
      1,
      1,
      1,
      0,
      0,
      0,
      0,
      0,
      0,
      0,
      0,
      0,
      0,
      0,
      0,
      0,
      0,
      0,
      0,
      0,
      0,
      0,
      0,
      0,
      0,
      0,
      0,
      0,
      0,
      0,
      0,
      0,
      0,
      0,
      0,
      0,
      0,
      0,
      0,
      0,
      0,
      0,
      0,
      null,
      null,
      null,
      null,
      null,
      null,
      null,
      null,
      null,
      null,
      null,
      null,
      null,
      null,
      null,
      null,
      null,
      null,
      null,
      null,
      null,
      null,
      null,
      null,
      null,
      null,
      null,
      null,
      null,
      null,
      null,
      null,
      null,
      null,
      null,
      null,
      null,
      null,
      null,
      null
    ],
    "baseline_f1": 0.9
  },
  "dataset_ref": "synthetic-evaluation-window"
}
